{
  "symbol": "MHO",
  "as_of_date": "2026-04-10",
  "spot_price": 125.0,
  "expected_move": {
    "earnings_date": "2026-04-22",
    "expiration": "2026-05-15",
    "dte": 35,
    "lead_time_days": 12,
    "atm_strike": 125.0,
    "atm_iv": 0.426851,
    "straddle_abs": 13.2,
    "straddle_pct": 0.1056,
    "iv_pct": 0.13218,
    "skew_atm": -0.0039,
    "term_slope": null,
    "total_vega": 0.306
  },
  "straddle_features": [
    {
      "expiration": "2026-04-17",
      "dte": 7,
      "atm_strike": 125.0,
      "atm_iv": 0.41825,
      "atm_call_iv": 0.4332,
      "atm_put_iv": 0.4033,
      "straddle_mid": 5.875,
      "em_straddle": 5.875,
      "em_straddle_pct": 0.047,
      "em_iv": 7.240166,
      "em_iv_pct": 0.057921,
      "call_delta": 0.4719,
      "call_gamma": 0.0539,
      "call_vega": 0.0684,
      "call_theta": -0.2603
    },
    {
      "expiration": "2026-05-15",
      "dte": 35,
      "atm_strike": 125.0,
      "atm_iv": 0.42685,
      "atm_call_iv": 0.429,
      "atm_put_iv": 0.4247,
      "straddle_mid": 13.2,
      "em_straddle": 13.2,
      "em_straddle_pct": 0.1056,
      "em_iv": 16.522391,
      "em_iv_pct": 0.132179,
      "call_delta": 0.5174,
      "call_gamma": 0.0244,
      "call_vega": 0.1531,
      "call_theta": -0.1086
    }
  ],
  "earnings_history": [
    {
      "date": "2026-04-22",
      "timing": "unknown"
    },
    {
      "date": "2026-01-28",
      "timing": "unknown"
    },
    {
      "date": "2025-10-22",
      "timing": "unknown"
    },
    {
      "date": "2025-07-23",
      "timing": "unknown"
    },
    {
      "date": "2025-04-23",
      "timing": "unknown"
    },
    {
      "date": "2025-01-29",
      "timing": "unknown"
    },
    {
      "date": "2024-10-30",
      "timing": "unknown"
    },
    {
      "date": "2024-07-30",
      "timing": "unknown"
    },
    {
      "date": "2024-04-24",
      "timing": "unknown"
    },
    {
      "date": "2024-01-31",
      "timing": "unknown"
    },
    {
      "date": "2023-10-25",
      "timing": "unknown"
    },
    {
      "date": "2023-07-26",
      "timing": "unknown"
    }
  ],
  "next_earnings": "2026-04-22"
}